{
  "schema_version": "agent-trace/v1",
  "trace_id": "fixture-debug-compile-first",
  "workflow_id": "debug",
  "started_at": "0",
  "ended_at": "1",
  "outcome": "ok",
  "events": [
    { "ts": "0", "kind": "tool_call", "tool": "compile_context" },
    { "ts": "0", "kind": "tool_result", "tool": "compile_context", "ok": true, "hit_count": 4 }
  ],
  "metrics": {
    "first_tool": "compile_context",
    "chose_compile_first": true,
    "refusal_count": 0,
    "repair_success_count": 0,
    "hops": 1
  }
}
