{
  "schema_version": "agent-trace/v1",
  "trace_id": "fixture-scope-repair",
  "workflow_id": "review",
  "started_at": "0",
  "ended_at": "2",
  "outcome": "repaired",
  "events": [
    { "ts": "0", "kind": "tool_call", "tool": "compile_context" },
    {
      "ts": "0",
      "kind": "refusal",
      "tool": "compile_context",
      "ok": false,
      "error_code": "SCOPE_UNRESOLVED",
      "repair_action": "pick_anchor"
    },
    { "ts": "1", "kind": "tool_call", "tool": "compile_context" },
    { "ts": "1", "kind": "repair", "tool": "compile_context", "ok": true, "repair_action": "pick_anchor" },
    { "ts": "1", "kind": "tool_result", "tool": "compile_context", "ok": true }
  ],
  "metrics": {
    "first_tool": "compile_context",
    "chose_compile_first": true,
    "refusal_count": 1,
    "repair_success_count": 1,
    "hops": 2
  }
}
